{
    "$schema": "https://json-schema.org/draft/2020-12/schema",
    "title": "component_files_folders package serialized envelope",
    "description": "Generated from pinned Table and Remote Config. Bounds known JSON types only, not conditional forms, SQL defaults, compiler behavior or semantic closure. Filesystem payloads are raw files; their Config map is only transport metadata.",
    "type": "object",
    "properties": {
        "joomla_component": {
            "type": [
                "null",
                "string"
            ],
            "description": "Source-derived envelope; see reference/component_files_folders.json for exact metadata, conditions and subfields."
        },
        "addfoldersfullpath": {
            "type": [
                "null",
                "object",
                "array",
                "string"
            ],
            "description": "Source-derived envelope; see reference/component_files_folders.json for exact metadata, conditions and subfields."
        },
        "addfilesfullpath": {
            "type": [
                "null",
                "object",
                "array",
                "string"
            ],
            "description": "Source-derived envelope; see reference/component_files_folders.json for exact metadata, conditions and subfields."
        },
        "addfolders": {
            "type": [
                "null",
                "object",
                "array",
                "string"
            ],
            "description": "Source-derived envelope; see reference/component_files_folders.json for exact metadata, conditions and subfields."
        },
        "addfiles": {
            "type": [
                "null",
                "object",
                "array",
                "string"
            ],
            "description": "Source-derived envelope; see reference/component_files_folders.json for exact metadata, conditions and subfields."
        },
        "@dependencies": {
            "$ref": "dependencies.schema.json"
        }
    },
    "additionalProperties": false,
    "required": [
        "joomla_component"
    ]
}
